<?xml version="1.0" encoding="UTF-8"?>
<!--
To change this license header, choose License Headers in Project Properties.
To change this template file, choose Tools | Templates
and open the template in the editor.
-->


<armylist
    xmlns:xsi='http://www.w3.org/2001/XMLSchema-instance'
    xsi:noNamespaceSchemaLocation='army.xsd'>
    
        <faction>Circle Orboros</faction>
        <description>Army I brought last week</description>
        <player>Geekly</player>
        <army>
            <themeforce>Rock of Orboros</themeforce>
            <tier>4</tier>
            <caster>
                <name>Baldur</name>
                <points>6</points>
                <focusfury>6</focusfury>
            </caster>
            <models>
                <solo>    
                    <name>Warpwolf Stalker</name>
                    <pointcost>10</pointcost>
                </solo>
                <unit>
                    <name>Wold Shrimp</name>
                    <pointcost>5</pointcost>
                    <minmax>max</minmax>  
                </unit>
            </models>
        </army>
</armylist>
